{
 "name": "key-order",
 "family": "agent",
 "authority": "pinned Pi b7bb00b9 agent-loop.ts prepareToolCall/executePreparedToolCall/finalizeExecutedToolCall + ai/src/utils/validation.ts validateToolArguments (typebox 1.3.7) + coding-agent edit.ts prepareEditArguments (sliced unmodified), raw = JSON.parse of the provider text, under Node 22.15.1 (L0206-D001 k1_boundaries.mjs)",
 "pi_revision": "b7bb00b936dbe21b8e160b3e89efdec361846699",
 "requirements": [
  "AI-003",
  "TOOL-003"
 ],
 "witnesses": [
  "ecmascript_object_key_order"
 ],
 "notes": "Tool-argument object key enumeration order (L0206-D001, K1): ECMAScript OrdinaryOwnPropertyKeys, recursively, at construction, session replay, the pre-execute listener and execute (the tools/execution-start payload is the constructed object). `arguments` is an insertion sequence the runner builds by plain assignment; ordering is the pipeline's job. GENERATED from the pinned-Pi K1 boundary authority; regenerate with harness/make_scenarios.py.",
 "key_order": {
  "cases": [
   {
    "id": "insertion/non-index-only",
    "provider_text": "{\"b\":1,\"a\":2,\"c\":3}",
    "arguments": {
     "$o": [
      [
       "b",
       1
      ],
      [
       "a",
       2
      ],
      [
       "c",
       3
      ]
     ]
    },
    "schema": {
     "type": "object",
     "properties": {}
    },
    "expect": {
     "raw": {
      "o": [
       [
        "b",
        1
       ],
       [
        "a",
        2
       ],
       [
        "c",
        3
       ]
      ]
     },
     "replay": {
      "o": [
       [
        "b",
        1
       ],
       [
        "a",
        2
       ],
       [
        "c",
        3
       ]
      ]
     },
     "hook": {
      "o": [
       [
        "b",
        1
       ],
       [
        "a",
        2
       ],
       [
        "c",
        3
       ]
      ]
     },
     "execute": {
      "o": [
       [
        "b",
        1
       ],
       [
        "a",
        2
       ],
       [
        "c",
        3
       ]
      ]
     },
     "start": {
      "o": [
       [
        "b",
        1
       ],
       [
        "a",
        2
       ],
       [
        "c",
        3
       ]
      ]
     },
     "update": {
      "o": [
       [
        "b",
        1
       ],
       [
        "a",
        2
       ],
       [
        "c",
        3
       ]
      ]
     }
    }
   },
   {
    "id": "insertion/reverse-alphabetic",
    "provider_text": "{\"z\":1,\"y\":2,\"x\":3,\"a\":4}",
    "arguments": {
     "$o": [
      [
       "z",
       1
      ],
      [
       "y",
       2
      ],
      [
       "x",
       3
      ],
      [
       "a",
       4
      ]
     ]
    },
    "schema": {
     "type": "object",
     "properties": {}
    },
    "expect": {
     "raw": {
      "o": [
       [
        "z",
        1
       ],
       [
        "y",
        2
       ],
       [
        "x",
        3
       ],
       [
        "a",
        4
       ]
      ]
     },
     "replay": {
      "o": [
       [
        "z",
        1
       ],
       [
        "y",
        2
       ],
       [
        "x",
        3
       ],
       [
        "a",
        4
       ]
      ]
     },
     "hook": {
      "o": [
       [
        "z",
        1
       ],
       [
        "y",
        2
       ],
       [
        "x",
        3
       ],
       [
        "a",
        4
       ]
      ]
     },
     "execute": {
      "o": [
       [
        "z",
        1
       ],
       [
        "y",
        2
       ],
       [
        "x",
        3
       ],
       [
        "a",
        4
       ]
      ]
     },
     "start": {
      "o": [
       [
        "z",
        1
       ],
       [
        "y",
        2
       ],
       [
        "x",
        3
       ],
       [
        "a",
        4
       ]
      ]
     },
     "update": {
      "o": [
       [
        "z",
        1
       ],
       [
        "y",
        2
       ],
       [
        "x",
        3
       ],
       [
        "a",
        4
       ]
      ]
     }
    }
   },
   {
    "id": "index/only-ascending",
    "provider_text": "{\"0\":1,\"1\":2,\"2\":3}",
    "arguments": {
     "$o": [
      [
       "0",
       1
      ],
      [
       "1",
       2
      ],
      [
       "2",
       3
      ]
     ]
    },
    "schema": {
     "type": "object",
     "properties": {}
    },
    "expect": {
     "raw": {
      "o": [
       [
        "0",
        1
       ],
       [
        "1",
        2
       ],
       [
        "2",
        3
       ]
      ]
     },
     "replay": {
      "o": [
       [
        "0",
        1
       ],
       [
        "1",
        2
       ],
       [
        "2",
        3
       ]
      ]
     },
     "hook": {
      "o": [
       [
        "0",
        1
       ],
       [
        "1",
        2
       ],
       [
        "2",
        3
       ]
      ]
     },
     "execute": {
      "o": [
       [
        "0",
        1
       ],
       [
        "1",
        2
       ],
       [
        "2",
        3
       ]
      ]
     },
     "start": {
      "o": [
       [
        "0",
        1
       ],
       [
        "1",
        2
       ],
       [
        "2",
        3
       ]
      ]
     },
     "update": {
      "o": [
       [
        "0",
        1
       ],
       [
        "1",
        2
       ],
       [
        "2",
        3
       ]
      ]
     }
    }
   },
   {
    "id": "index/only-reverse",
    "provider_text": "{\"2\":1,\"1\":2,\"0\":3}",
    "arguments": {
     "$o": [
      [
       "2",
       1
      ],
      [
       "1",
       2
      ],
      [
       "0",
       3
      ]
     ]
    },
    "schema": {
     "type": "object",
     "properties": {}
    },
    "expect": {
     "raw": {
      "o": [
       [
        "0",
        3
       ],
       [
        "1",
        2
       ],
       [
        "2",
        1
       ]
      ]
     },
     "replay": {
      "o": [
       [
        "0",
        3
       ],
       [
        "1",
        2
       ],
       [
        "2",
        1
       ]
      ]
     },
     "hook": {
      "o": [
       [
        "0",
        3
       ],
       [
        "1",
        2
       ],
       [
        "2",
        1
       ]
      ]
     },
     "execute": {
      "o": [
       [
        "0",
        3
       ],
       [
        "1",
        2
       ],
       [
        "2",
        1
       ]
      ]
     },
     "start": {
      "o": [
       [
        "0",
        3
       ],
       [
        "1",
        2
       ],
       [
        "2",
        1
       ]
      ]
     },
     "update": {
      "o": [
       [
        "0",
        3
       ],
       [
        "1",
        2
       ],
       [
        "2",
        1
       ]
      ]
     }
    }
   },
   {
    "id": "index/numeric-not-lexicographic",
    "provider_text": "{\"10\":1,\"9\":2,\"100\":3,\"2\":4}",
    "arguments": {
     "$o": [
      [
       "10",
       1
      ],
      [
       "9",
       2
      ],
      [
       "100",
       3
      ],
      [
       "2",
       4
      ]
     ]
    },
    "schema": {
     "type": "object",
     "properties": {}
    },
    "expect": {
     "raw": {
      "o": [
       [
        "2",
        4
       ],
       [
        "9",
        2
       ],
       [
        "10",
        1
       ],
       [
        "100",
        3
       ]
      ]
     },
     "replay": {
      "o": [
       [
        "2",
        4
       ],
       [
        "9",
        2
       ],
       [
        "10",
        1
       ],
       [
        "100",
        3
       ]
      ]
     },
     "hook": {
      "o": [
       [
        "2",
        4
       ],
       [
        "9",
        2
       ],
       [
        "10",
        1
       ],
       [
        "100",
        3
       ]
      ]
     },
     "execute": {
      "o": [
       [
        "2",
        4
       ],
       [
        "9",
        2
       ],
       [
        "10",
        1
       ],
       [
        "100",
        3
       ]
      ]
     },
     "start": {
      "o": [
       [
        "2",
        4
       ],
       [
        "9",
        2
       ],
       [
        "10",
        1
       ],
       [
        "100",
        3
       ]
      ]
     },
     "update": {
      "o": [
       [
        "2",
        4
       ],
       [
        "9",
        2
       ],
       [
        "10",
        1
       ],
       [
        "100",
        3
       ]
      ]
     }
    }
   },
   {
    "id": "mixed/index-after-names",
    "provider_text": "{\"b\":1,\"2\":2,\"1\":3,\"a\":4}",
    "arguments": {
     "$o": [
      [
       "b",
       1
      ],
      [
       "2",
       2
      ],
      [
       "1",
       3
      ],
      [
       "a",
       4
      ]
     ]
    },
    "schema": {
     "type": "object",
     "properties": {}
    },
    "expect": {
     "raw": {
      "o": [
       [
        "1",
        3
       ],
       [
        "2",
        2
       ],
       [
        "b",
        1
       ],
       [
        "a",
        4
       ]
      ]
     },
     "replay": {
      "o": [
       [
        "1",
        3
       ],
       [
        "2",
        2
       ],
       [
        "b",
        1
       ],
       [
        "a",
        4
       ]
      ]
     },
     "hook": {
      "o": [
       [
        "1",
        3
       ],
       [
        "2",
        2
       ],
       [
        "b",
        1
       ],
       [
        "a",
        4
       ]
      ]
     },
     "execute": {
      "o": [
       [
        "1",
        3
       ],
       [
        "2",
        2
       ],
       [
        "b",
        1
       ],
       [
        "a",
        4
       ]
      ]
     },
     "start": {
      "o": [
       [
        "1",
        3
       ],
       [
        "2",
        2
       ],
       [
        "b",
        1
       ],
       [
        "a",
        4
       ]
      ]
     },
     "update": {
      "o": [
       [
        "1",
        3